{
  "schema_version": "1.0.0",
  "episode_id": "PD-2026-011-mahanoy",
  "revision": "v001",
  "generated_from": "03_script/script.annotated.v001.json",
  "source_annotated_sha256": "sha256:b28f42c87c4e194d6ebf41ca98f383f7f233bcd31e6e7ef78b8a9a396438c4f4",
  "shots": [
    {
      "span_id": "SPN-0001",
      "chapter_id": "hook",
      "narrative_function": "hook_cold_open",
      "estimated_seconds": 29.2,
      "suggested_asset_type": "stock_video",
      "motion": "video_native",
      "priority": "A",
      "search_keywords": [
        "phone screen",
        "post being typed at night"
      ],
      "on_screen_text": [
        "Can your school punish your weekend post?"
      ],
      "rights_note": "Commercial-use only; log source/author/license/date/scene/sha256; no unauthorized sources; ambiguous rights -> review, do not auto-place.",
      "visual_intent": "A phone screen, a post being typed at night (symbolic, AI-disclosed); on-screen text CENSORED."
    },
    {
      "span_id": "SPN-0002",
      "chapter_id": "opening",
      "narrative_function": "thesis_and_promise",
      "estimated_seconds": 41.6,
      "suggested_asset_type": "motion_graphic",
      "motion": "graphic_anim",
      "priority": "A",
      "search_keywords": [],
      "on_screen_text": [
        "\"...at the schoolhouse gate\" — Tinker, 1969"
      ],
      "rights_note": "Coded in Remotion; no external rights."
    },
    {
      "span_id": "SPN-0003",
      "chapter_id": "act1",
      "narrative_function": "event",
      "estimated_seconds": 10.4,
      "suggested_asset_type": "motion_graphic",
      "motion": "graphic_anim",
      "priority": "B",
      "search_keywords": [
        "Map/era: Mahanoy",
        "PA",
        "2017"
      ],
      "on_screen_text": [
        "Mahanoy, PA — 2017"
      ],
      "rights_note": "Coded in Remotion; no external rights.",
      "visual_intent": "Map/era: Mahanoy, PA, 2017; symbolic; no real-person likeness."
    },
    {
      "span_id": "SPN-0004",
      "chapter_id": "act1",
      "narrative_function": "event",
      "estimated_seconds": 14.8,
      "suggested_asset_type": "ai_image",
      "motion": "ken_burns",
      "priority": "C",
      "search_keywords": [],
      "on_screen_text": [],
      "rights_note": "AI image (Codex/SDXL) - use freely; no real-person likeness (inv.11); AI-disclosed; always apply motion (never static)."
    },
    {
      "span_id": "SPN-0005",
      "chapter_id": "act1",
      "narrative_function": "event",
      "estimated_seconds": 30.0,
      "suggested_asset_type": "stock_video",
      "motion": "video_native",
      "priority": "B",
      "search_keywords": [
        "raised hands silhouetted"
      ],
      "on_screen_text": [
        "[caption censored]"
      ],
      "rights_note": "Commercial-use only; log source/author/license/date/scene/sha256; no unauthorized sources; ambiguous rights -> review, do not auto-place.",
      "visual_intent": "Symbolic Snapchat frame; caption CENSORED/blurred; raised hands silhouetted, no faces."
    },
    {
      "span_id": "SPN-0006",
      "chapter_id": "act1",
      "narrative_function": "event_turn",
      "estimated_seconds": 22.8,
      "suggested_asset_type": "ai_image",
      "motion": "ken_burns",
      "priority": "A",
      "search_keywords": [],
      "on_screen_text": [
        "Snaps \"disappear\" — screenshots don't"
      ],
      "rights_note": "AI image (Codex/SDXL) - use freely; no real-person likeness (inv.11); AI-disclosed; always apply motion (never static)."
    },
    {
      "span_id": "SPN-0007",
      "chapter_id": "act1",
      "narrative_function": "event",
      "estimated_seconds": 12.8,
      "suggested_asset_type": "stock_video",
      "motion": "video_native",
      "priority": "C",
      "search_keywords": [],
      "on_screen_text": [
        "Suspended from JV cheer — 1 year"
      ],
      "rights_note": "Commercial-use only; log source/author/license/date/scene/sha256; no unauthorized sources; ambiguous rights -> review, do not auto-place."
    },
    {
      "span_id": "SPN-0008",
      "chapter_id": "act1",
      "narrative_function": "conflict",
      "estimated_seconds": 25.2,
      "suggested_asset_type": "ai_image",
      "motion": "ken_burns",
      "priority": "C",
      "search_keywords": [],
      "on_screen_text": [
        "School's order vs. a student's voice"
      ],
      "rights_note": "AI image (Codex/SDXL) - use freely; no real-person likeness (inv.11); AI-disclosed; always apply motion (never static)."
    },
    {
      "span_id": "SPN-0009",
      "chapter_id": "act2",
      "narrative_function": "context_history",
      "estimated_seconds": 15.6,
      "suggested_asset_type": "motion_graphic",
      "motion": "graphic_anim",
      "priority": "C",
      "search_keywords": [],
      "on_screen_text": [
        "Tinker v. Des Moines (1969)"
      ],
      "rights_note": "Coded in Remotion; no external rights."
    },
    {
      "span_id": "SPN-0010",
      "chapter_id": "act2",
      "narrative_function": "system_explainer",
      "estimated_seconds": 19.6,
      "suggested_asset_type": "ai_image",
      "motion": "ken_burns",
      "priority": "C",
      "search_keywords": [],
      "on_screen_text": [
        "Test: \"substantial disruption\""
      ],
      "rights_note": "AI image (Codex/SDXL) - use freely; no real-person likeness (inv.11); AI-disclosed; always apply motion (never static)."
    },
    {
      "span_id": "SPN-0011",
      "chapter_id": "act2",
      "narrative_function": "analysis",
      "estimated_seconds": 12.8,
      "suggested_asset_type": "stock_video",
      "motion": "video_native",
      "priority": "C",
      "search_keywords": [],
      "on_screen_text": [],
      "rights_note": "Commercial-use only; log source/author/license/date/scene/sha256; no unauthorized sources; ambiguous rights -> review, do not auto-place."
    },
    {
      "span_id": "SPN-0012",
      "chapter_id": "act2",
      "narrative_function": "turn",
      "estimated_seconds": 27.6,
      "suggested_asset_type": "ai_image",
      "motion": "ken_burns",
      "priority": "C",
      "search_keywords": [],
      "on_screen_text": [
        "The phone erased the gate"
      ],
      "rights_note": "AI image (Codex/SDXL) - use freely; no real-person likeness (inv.11); AI-disclosed; always apply motion (never static)."
    },
    {
      "span_id": "SPN-0013",
      "chapter_id": "act2",
      "narrative_function": "stakes",
      "estimated_seconds": 25.6,
      "suggested_asset_type": "ai_image",
      "motion": "ken_burns",
      "priority": "C",
      "search_keywords": [],
      "on_screen_text": [],
      "rights_note": "AI image (Codex/SDXL) - use freely; no real-person likeness (inv.11); AI-disclosed; always apply motion (never static)."
    },
    {
      "span_id": "SPN-0014",
      "chapter_id": "act3",
      "narrative_function": "ruling",
      "estimated_seconds": 14.0,
      "suggested_asset_type": "motion_graphic",
      "motion": "graphic_anim",
      "priority": "A",
      "search_keywords": [
        "Timeline hit 2021",
        "8–1 graphic",
        "citation 594 U",
        "S",
        "180"
      ],
      "on_screen_text": [
        "2021 — 8–1",
        "Mahanoy v. B.L., 594 U.S. 180"
      ],
      "rights_note": "Coded in Remotion; no external rights.",
      "visual_intent": "Timeline hit 2021; 8–1 graphic; citation 594 U.S. 180."
    },
    {
      "span_id": "SPN-0015",
      "chapter_id": "act3",
      "narrative_function": "ruling",
      "estimated_seconds": 27.6,
      "suggested_asset_type": "stock_video",
      "motion": "video_native",
      "priority": "A",
      "search_keywords": [],
      "on_screen_text": [],
      "rights_note": "Commercial-use only; log source/author/license/date/scene/sha256; no unauthorized sources; ambiguous rights -> review, do not auto-place."
    },
    {
      "span_id": "SPN-0016",
      "chapter_id": "act3",
      "narrative_function": "ruling",
      "estimated_seconds": 16.8,
      "suggested_asset_type": "ai_image",
      "motion": "ken_burns",
      "priority": "A",
      "search_keywords": [],
      "on_screen_text": [
        "Disruption: a few minutes of class chatter"
      ],
      "rights_note": "AI image (Codex/SDXL) - use freely; no real-person likeness (inv.11); AI-disclosed; always apply motion (never static)."
    },
    {
      "span_id": "SPN-0017",
      "chapter_id": "act3",
      "narrative_function": "ruling_limit",
      "estimated_seconds": 29.2,
      "suggested_asset_type": "ai_image",
      "motion": "ken_burns",
      "priority": "A",
      "search_keywords": [],
      "on_screen_text": [
        "Still reachable: bullying · threats · cheating"
      ],
      "rights_note": "AI image (Codex/SDXL) - use freely; no real-person likeness (inv.11); AI-disclosed; always apply motion (never static)."
    },
    {
      "span_id": "SPN-0018",
      "chapter_id": "act3",
      "narrative_function": "ruling_counterpoint",
      "estimated_seconds": 27.2,
      "suggested_asset_type": "stock_video",
      "motion": "video_native",
      "priority": "A",
      "search_keywords": [],
      "on_screen_text": [
        "Dissent: Thomas, J. (alone)"
      ],
      "rights_note": "Commercial-use only; log source/author/license/date/scene/sha256; no unauthorized sources; ambiguous rights -> review, do not auto-place."
    },
    {
      "span_id": "SPN-0019",
      "chapter_id": "act4",
      "narrative_function": "impact",
      "estimated_seconds": 20.0,
      "suggested_asset_type": "ai_image",
      "motion": "ken_burns",
      "priority": "C",
      "search_keywords": [],
      "on_screen_text": [],
      "rights_note": "AI image (Codex/SDXL) - use freely; no real-person likeness (inv.11); AI-disclosed; always apply motion (never static)."
    },
    {
      "span_id": "SPN-0020",
      "chapter_id": "act4",
      "narrative_function": "impact_nuance",